{
  "schema_version": 1,
  "context_id": "CTX-CURRENT-1",
  "created_at": "2026-08-05T00:00:00Z",
  "revision": 1,
  "context_revision": 1,
  "context_purpose": "IMPLEMENTATION",
  "recipient_role": "IMPLEMENTER",
  "run_id": "RUN-CURRENT-1",
  "attempt_id": "ATT-CURRENT-1",
  "dispatch_id": "DSP-CURRENT-1",
  "task": {
    "task_id": "TASK-CURRENT-1",
    "objective": "Use a versioned context package"
  },
  "required_documents": [],
  "source_items": [],
  "source_hashes": [],
  "inclusion_reasons": [],
  "excluded_sensitive_items": [],
  "previous_context_id": null,
  "context_delta": null,
  "code_context": {
    "files_to_read": [],
    "symbols_to_inspect": [],
    "existing_patterns": []
  },
  "constraints": {
    "inherited": [],
    "task_specific": []
  },
  "examples": [],
  "review_history": [],
  "budget": {
    "max_files": 20,
    "max_reference_documents": 8,
    "max_examples": 3,
    "max_review_history_items": 10,
    "max_bytes": 100000
  }
}
