{
  "context_id": "CTX-SP-01-B01-T01-1",
  "created_at": "2026-08-02T10:00:00Z",
  "revision": 1,
  "task": {
    "task_id": "SP-01-B01-T01",
    "objective": "Implement the product service"
  },
  "required_documents": ["docs/agentic/tasks/SP-01-B01-T01.md"],
  "code_context": {
    "files_to_read": ["backend/src/products/service.ts"],
    "symbols_to_inspect": ["ProductService"],
    "existing_patterns": ["repository injection"]
  },
  "constraints": {
    "inherited": ["Do not change the public API"],
    "task_specific": ["Keep the write scope bounded to the product module"]
  },
  "review_history": [],
  "budget": {
    "max_files": 20,
    "max_reference_documents": 8,
    "max_examples": 3
  }
}
